{
  "assignment_id": "ASSIGN-P2-A",
  "round": 1,
  "phase": "OPENING",
  "private_goal": "维护角色自身利益并按角色设定表达",
  "perceived_stakes": [
    "内容可信度与传播风险"
  ],
  "private_belief_state": [
    "当前关键事实未被核验"
  ],
  "confidence": "MEDIUM",
  "uncertainties": [
    "原始来源是否存在"
  ],
  "intended_emphasis": [
    "对自己最有利的论点"
  ],
  "intended_omissions": [],
  "rhetorical_tactics": [
    "引用原文",
    "压缩争议点"
  ],
  "truth_handling_this_turn": "HONEST",
  "likely_next_action": [
    "继续回应对方公开发言"
  ],
  "emotional_state": "受角色设定影响",
  "continuity_notes": "保持案件级角色连续性",
  "raw_chain_of_thought_saved": false,
  "epistemic_state": [
    {
      "proposition": "当前关键事实未被核验",
      "private_status": "UNCERTAIN",
      "basis_refs": []
    }
  ],
  "private_message_strategy": "表达强硬，但不引入未核验事实。",
  "planned_public_claims": [
    {
      "claim_text": "出轨者和第三者不是同一统计对象。",
      "private_status": "SUPPORTED",
      "planned_treatment": "STATE_AS_SUPPORTED"
    }
  ],
  "private_action_intent": [
    "继续回应对方公开发言"
  ]
}
